[10.01.2026  1:05:02,02] Starting Phase 3 Calibration Daemon 
2026-01-10 01:05:02,340 [PHASE3-CALIBRATION] INFO: ============================================================
2026-01-10 01:05:02,343 [PHASE3-CALIBRATION] INFO: PHASE 3 CALIBRATION DAEMON - CEO-DIR-2026-025
2026-01-10 01:05:02,343 [PHASE3-CALIBRATION] INFO: Mode: DEFENSIVE_ONLY
2026-01-10 01:05:02,343 [PHASE3-CALIBRATION] INFO: Started: 2026-01-10T00:05:02.340019+00:00
2026-01-10 01:05:02,343 [PHASE3-CALIBRATION] INFO: ============================================================
2026-01-10 01:05:02,420 [PHASE3-CALIBRATION] INFO: Starting learning classification update...
2026-01-10 01:05:05,129 [PHASE3-CALIBRATION] INFO: Classified 74 decisions: {'WISDOM': 27, 'REGRET': 20, 'UNRESOLVED': 27}
2026-01-10 01:05:05,129 [PHASE3-CALIBRATION] INFO: Starting Brier score computation...
2026-01-10 01:05:08,130 [PHASE3-CALIBRATION] INFO: Computed 275 new Brier scores: avg=0.518288, accuracy=29.454545454545457%
2026-01-10 01:05:08,130 [PHASE3-CALIBRATION] INFO: Starting forecast-outcome reconciliation...
2026-01-10 01:05:09,640 [PHASE3-CALIBRATION] INFO: Reconciliation complete: 0 outcomes, 0 pairs
2026-01-10 01:05:09,654 [PHASE3-CALIBRATION] INFO: Refreshing materialized views...
2026-01-10 01:05:09,739 [PHASE3-CALIBRATION] INFO: Materialized views refreshed
2026-01-10 01:05:09,820 [PHASE3-CALIBRATION] INFO: Governance action logged: fe7facd3-d1c3-47c0-a32a-0eae908fb32c
2026-01-10 01:05:09,820 [PHASE3-CALIBRATION] INFO: Calibration status: Brier=0.6556
2026-01-10 01:05:09,821 [PHASE3-CALIBRATION] WARNING: CALIBRATION WARNING: Brier score 0.6556 > 0.3. High-confidence decisions should be flagged.
2026-01-10 01:05:09,822 [PHASE3-CALIBRATION] INFO: ============================================================
2026-01-10 01:05:09,826 [PHASE3-CALIBRATION] INFO: PHASE 3 CALIBRATION COMPLETE
2026-01-10 01:05:09,826 [PHASE3-CALIBRATION] INFO: Duration: 7.40s
2026-01-10 01:05:09,826 [PHASE3-CALIBRATION] INFO: ============================================================
{
  "directive": "CEO-DIR-2026-025",
  "daemon_version": "1.0.0",
  "execution_mode": "DEFENSIVE_ONLY",
  "start_time": "2026-01-10T00:05:02.340019+00:00",
  "results": {
    "classifications": {
      "WISDOM": 27,
      "REGRET": 20,
      "UNRESOLVED": 27
    },
    "brier_scores": {
      "new_scores": 275,
      "avg_brier": 0.5183,
      "accuracy_pct": 29.5
    },
    "reconciliation": {
      "outcomes_created": 0,
      "pairs_created": 0
    },
    "calibration_status": {
      "total_scores": 1154,
      "avg_brier": "0.6556",
      "correct": 223,
      "overconfident_wrong": 624
    }
  },
  "end_time": "2026-01-10T00:05:09.740542+00:00",
  "duration_seconds": 7.400523,
  "status": "SUCCESS"
}
[10.01.2026  1:05:10,00] Daemon execution complete 
[11.01.2026  1:05:01,99] Starting Phase 3 Calibration Daemon 
2026-01-11 01:05:02,308 [PHASE3-CALIBRATION] INFO: ============================================================
2026-01-11 01:05:02,308 [PHASE3-CALIBRATION] INFO: PHASE 3 CALIBRATION DAEMON - CEO-DIR-2026-025
2026-01-11 01:05:02,308 [PHASE3-CALIBRATION] INFO: Mode: DEFENSIVE_ONLY
2026-01-11 01:05:02,308 [PHASE3-CALIBRATION] INFO: Started: 2026-01-11T00:05:02.308845+00:00
2026-01-11 01:05:02,308 [PHASE3-CALIBRATION] INFO: ============================================================
2026-01-11 01:05:02,448 [PHASE3-CALIBRATION] INFO: Starting learning classification update...
2026-01-11 01:05:03,724 [PHASE3-CALIBRATION] INFO: Classified 9 decisions: {'WISDOM': 1, 'REGRET': 5, 'UNRESOLVED': 3}
2026-01-11 01:05:03,724 [PHASE3-CALIBRATION] INFO: Starting Brier score computation...
2026-01-11 01:05:05,657 [PHASE3-CALIBRATION] INFO: Computed 94 new Brier scores: avg=0.4530617021276596, accuracy=44.680851063829785%
2026-01-11 01:05:05,657 [PHASE3-CALIBRATION] INFO: Starting forecast-outcome reconciliation...
2026-01-11 01:05:07,708 [PHASE3-CALIBRATION] INFO: Reconciliation complete: 6 outcomes, 0 pairs
2026-01-11 01:05:07,708 [PHASE3-CALIBRATION] INFO: Refreshing materialized views...
2026-01-11 01:05:07,795 [PHASE3-CALIBRATION] INFO: Materialized views refreshed
2026-01-11 01:05:07,801 [PHASE3-CALIBRATION] INFO: Governance action logged: b552cbe7-7599-4d06-a056-1212a99e8181
2026-01-11 01:05:07,801 [PHASE3-CALIBRATION] INFO: Calibration status: Brier=0.6404
2026-01-11 01:05:07,801 [PHASE3-CALIBRATION] WARNING: CALIBRATION WARNING: Brier score 0.6404 > 0.3. High-confidence decisions should be flagged.
2026-01-11 01:05:07,801 [PHASE3-CALIBRATION] INFO: ============================================================
2026-01-11 01:05:07,801 [PHASE3-CALIBRATION] INFO: PHASE 3 CALIBRATION COMPLETE
2026-01-11 01:05:07,801 [PHASE3-CALIBRATION] INFO: Duration: 5.49s
2026-01-11 01:05:07,801 [PHASE3-CALIBRATION] INFO: ============================================================
{
  "directive": "CEO-DIR-2026-025",
  "daemon_version": "1.0.0",
  "execution_mode": "DEFENSIVE_ONLY",
  "start_time": "2026-01-11T00:05:02.308845+00:00",
  "results": {
    "classifications": {
      "WISDOM": 1,
      "REGRET": 5,
      "UNRESOLVED": 3
    },
    "brier_scores": {
      "new_scores": 94,
      "avg_brier": 0.4531,
      "accuracy_pct": 44.7
    },
    "reconciliation": {
      "outcomes_created": 6,
      "pairs_created": 0
    },
    "calibration_status": {
      "total_scores": 1248,
      "avg_brier": "0.6404",
      "correct": 265,
      "overconfident_wrong": 660
    }
  },
  "end_time": "2026-01-11T00:05:07.795750+00:00",
  "duration_seconds": 5.486905,
  "status": "SUCCESS"
}
[11.01.2026  1:05:07,83] Daemon execution complete 
[12.01.2026  1:05:01,97] Starting Phase 3 Calibration Daemon 
2026-01-12 01:05:02,270 [PHASE3-CALIBRATION] INFO: ============================================================
2026-01-12 01:05:02,270 [PHASE3-CALIBRATION] INFO: PHASE 3 CALIBRATION DAEMON - CEO-DIR-2026-025
2026-01-12 01:05:02,270 [PHASE3-CALIBRATION] INFO: Mode: DEFENSIVE_ONLY
2026-01-12 01:05:02,270 [PHASE3-CALIBRATION] INFO: Started: 2026-01-12T00:05:02.270570+00:00
2026-01-12 01:05:02,270 [PHASE3-CALIBRATION] INFO: ============================================================
2026-01-12 01:05:02,570 [PHASE3-CALIBRATION] INFO: Starting learning classification update...
2026-01-12 01:05:04,130 [PHASE3-CALIBRATION] INFO: Classified 12 decisions: {'WISDOM': 6, 'REGRET': 0, 'UNRESOLVED': 6}
2026-01-12 01:05:04,130 [PHASE3-CALIBRATION] INFO: Starting Brier score computation...
2026-01-12 01:05:05,810 [PHASE3-CALIBRATION] INFO: Computed 173 new Brier scores: avg=0.4704705202312139, accuracy=41.040462427745666%
2026-01-12 01:05:05,810 [PHASE3-CALIBRATION] INFO: Starting forecast-outcome reconciliation...
2026-01-12 01:05:07,856 [PHASE3-CALIBRATION] INFO: Reconciliation complete: 8 outcomes, 34 pairs
2026-01-12 01:05:07,867 [PHASE3-CALIBRATION] INFO: Refreshing materialized views...
2026-01-12 01:05:07,918 [PHASE3-CALIBRATION] INFO: Materialized views refreshed
2026-01-12 01:05:07,928 [PHASE3-CALIBRATION] INFO: Governance action logged: d87ce933-2cd2-46f8-a132-a691bff29169
2026-01-12 01:05:07,928 [PHASE3-CALIBRATION] INFO: Calibration status: Brier=0.6197
2026-01-12 01:05:07,928 [PHASE3-CALIBRATION] WARNING: CALIBRATION WARNING: Brier score 0.6197 > 0.3. High-confidence decisions should be flagged.
2026-01-12 01:05:07,928 [PHASE3-CALIBRATION] INFO: ============================================================
2026-01-12 01:05:07,934 [PHASE3-CALIBRATION] INFO: PHASE 3 CALIBRATION COMPLETE
2026-01-12 01:05:07,934 [PHASE3-CALIBRATION] INFO: Duration: 5.65s
2026-01-12 01:05:07,934 [PHASE3-CALIBRATION] INFO: ============================================================
{
  "directive": "CEO-DIR-2026-025",
  "daemon_version": "1.0.0",
  "execution_mode": "DEFENSIVE_ONLY",
  "start_time": "2026-01-12T00:05:02.270570+00:00",
  "results": {
    "classifications": {
      "WISDOM": 6,
      "REGRET": 0,
      "UNRESOLVED": 6
    },
    "brier_scores": {
      "new_scores": 173,
      "avg_brier": 0.4705,
      "accuracy_pct": 41.0
    },
    "reconciliation": {
      "outcomes_created": 8,
      "pairs_created": 34
    },
    "calibration_status": {
      "total_scores": 1421,
      "avg_brier": "0.6197",
      "correct": 336,
      "overconfident_wrong": 716
    }
  },
  "end_time": "2026-01-12T00:05:07.918042+00:00",
  "duration_seconds": 5.647472,
  "status": "SUCCESS"
}
[12.01.2026  1:05:08,24] Daemon execution complete 
[13.01.2026  1:05:02,04] Starting Phase 3 Calibration Daemon 
2026-01-13 01:05:02,358 [PHASE3-CALIBRATION] INFO: ============================================================
2026-01-13 01:05:02,358 [PHASE3-CALIBRATION] INFO: PHASE 3 CALIBRATION DAEMON - CEO-DIR-2026-025
2026-01-13 01:05:02,358 [PHASE3-CALIBRATION] INFO: Mode: DEFENSIVE_ONLY
2026-01-13 01:05:02,358 [PHASE3-CALIBRATION] INFO: Started: 2026-01-13T00:05:02.358134+00:00
2026-01-13 01:05:02,358 [PHASE3-CALIBRATION] INFO: ============================================================
2026-01-13 01:05:02,408 [PHASE3-CALIBRATION] INFO: Starting learning classification update...
2026-01-13 01:05:04,873 [PHASE3-CALIBRATION] INFO: Classified 106 decisions: {'WISDOM': 48, 'REGRET': 21, 'UNRESOLVED': 37}
2026-01-13 01:05:04,873 [PHASE3-CALIBRATION] INFO: Starting Brier score computation...
2026-01-13 01:05:07,520 [PHASE3-CALIBRATION] INFO: Computed 295 new Brier scores: avg=0.5662572881355932, accuracy=27.45762711864407%
2026-01-13 01:05:07,520 [PHASE3-CALIBRATION] INFO: Starting forecast-outcome reconciliation...
2026-01-13 01:05:10,088 [PHASE3-CALIBRATION] INFO: Reconciliation complete: 7 outcomes, 0 pairs
2026-01-13 01:05:10,098 [PHASE3-CALIBRATION] INFO: Refreshing materialized views...
2026-01-13 01:05:10,163 [PHASE3-CALIBRATION] INFO: Materialized views refreshed
2026-01-13 01:05:10,175 [PHASE3-CALIBRATION] INFO: Governance action logged: 6c0f3b36-3a0b-4e87-980f-da8f9e64542d
2026-01-13 01:05:10,175 [PHASE3-CALIBRATION] INFO: Calibration status: Brier=0.6105
2026-01-13 01:05:10,175 [PHASE3-CALIBRATION] WARNING: CALIBRATION WARNING: Brier score 0.6105 > 0.3. High-confidence decisions should be flagged.
2026-01-13 01:05:10,175 [PHASE3-CALIBRATION] INFO: ============================================================
2026-01-13 01:05:10,175 [PHASE3-CALIBRATION] INFO: PHASE 3 CALIBRATION COMPLETE
2026-01-13 01:05:10,175 [PHASE3-CALIBRATION] INFO: Duration: 7.81s
2026-01-13 01:05:10,175 [PHASE3-CALIBRATION] INFO: ============================================================
{
  "directive": "CEO-DIR-2026-025",
  "daemon_version": "1.0.0",
  "execution_mode": "DEFENSIVE_ONLY",
  "start_time": "2026-01-13T00:05:02.358134+00:00",
  "results": {
    "classifications": {
      "WISDOM": 48,
      "REGRET": 21,
      "UNRESOLVED": 37
    },
    "brier_scores": {
      "new_scores": 295,
      "avg_brier": 0.5663,
      "accuracy_pct": 27.5
    },
    "reconciliation": {
      "outcomes_created": 7,
      "pairs_created": 0
    },
    "calibration_status": {
      "total_scores": 1716,
      "avg_brier": "0.6105",
      "correct": 417,
      "overconfident_wrong": 836
    }
  },
  "end_time": "2026-01-13T00:05:10.163901+00:00",
  "duration_seconds": 7.805767,
  "status": "SUCCESS"
}
[13.01.2026  1:05:10,44] Daemon execution complete 
[14.01.2026  1:05:01,98] Starting Phase 3 Calibration Daemon 
2026-01-14 01:05:02,468 [PHASE3-CALIBRATION] INFO: ============================================================
2026-01-14 01:05:02,468 [PHASE3-CALIBRATION] INFO: PHASE 3 CALIBRATION DAEMON - CEO-DIR-2026-025
2026-01-14 01:05:02,468 [PHASE3-CALIBRATION] INFO: Mode: DEFENSIVE_ONLY
2026-01-14 01:05:02,468 [PHASE3-CALIBRATION] INFO: Started: 2026-01-14T00:05:02.468610+00:00
2026-01-14 01:05:02,469 [PHASE3-CALIBRATION] INFO: ============================================================
2026-01-14 01:05:02,550 [PHASE3-CALIBRATION] INFO: Starting learning classification update...
2026-01-14 01:05:06,290 [PHASE3-CALIBRATION] INFO: Classified 113 decisions: {'WISDOM': 53, 'REGRET': 22, 'UNRESOLVED': 38}
2026-01-14 01:05:06,290 [PHASE3-CALIBRATION] INFO: Starting Brier score computation...
2026-01-14 01:05:09,061 [PHASE3-CALIBRATION] INFO: Computed 478 new Brier scores: avg=0.5125514644351464, accuracy=35.98326359832636%
2026-01-14 01:05:09,061 [PHASE3-CALIBRATION] INFO: Starting forecast-outcome reconciliation...
2026-01-14 01:05:11,032 [PHASE3-CALIBRATION] INFO: Reconciliation complete: 16 outcomes, 16 pairs
2026-01-14 01:05:11,039 [PHASE3-CALIBRATION] INFO: Refreshing materialized views...
2026-01-14 01:05:11,104 [PHASE3-CALIBRATION] INFO: Materialized views refreshed
2026-01-14 01:05:11,125 [PHASE3-CALIBRATION] INFO: Governance action logged: 21ac5a86-fd0c-45e3-913c-b8f3cb304234
2026-01-14 01:05:11,126 [PHASE3-CALIBRATION] INFO: Calibration status: Brier=0.5892
2026-01-14 01:05:11,126 [PHASE3-CALIBRATION] WARNING: CALIBRATION WARNING: Brier score 0.5892 > 0.3. High-confidence decisions should be flagged.
2026-01-14 01:05:11,126 [PHASE3-CALIBRATION] INFO: ============================================================
2026-01-14 01:05:11,126 [PHASE3-CALIBRATION] INFO: PHASE 3 CALIBRATION COMPLETE
2026-01-14 01:05:11,126 [PHASE3-CALIBRATION] INFO: Duration: 8.64s
2026-01-14 01:05:11,126 [PHASE3-CALIBRATION] INFO: ============================================================
{
  "directive": "CEO-DIR-2026-025",
  "daemon_version": "1.0.0",
  "execution_mode": "DEFENSIVE_ONLY",
  "start_time": "2026-01-14T00:05:02.468610+00:00",
  "results": {
    "classifications": {
      "WISDOM": 53,
      "REGRET": 22,
      "UNRESOLVED": 38
    },
    "brier_scores": {
      "new_scores": 478,
      "avg_brier": 0.5126,
      "accuracy_pct": 36.0
    },
    "reconciliation": {
      "outcomes_created": 16,
      "pairs_created": 16
    },
    "calibration_status": {
      "total_scores": 2194,
      "avg_brier": "0.5892",
      "correct": 589,
      "overconfident_wrong": 1019
    }
  },
  "end_time": "2026-01-14T00:05:11.104948+00:00",
  "duration_seconds": 8.636338,
  "status": "SUCCESS"
}
[14.01.2026  1:05:11,15] Daemon execution complete 
[15.01.2026  1:05:02,00] Starting Phase 3 Calibration Daemon 
2026-01-15 01:05:02,491 [PHASE3-CALIBRATION] INFO: ============================================================
2026-01-15 01:05:02,491 [PHASE3-CALIBRATION] INFO: PHASE 3 CALIBRATION DAEMON - CEO-DIR-2026-025
2026-01-15 01:05:02,501 [PHASE3-CALIBRATION] INFO: Mode: DEFENSIVE_ONLY
2026-01-15 01:05:02,501 [PHASE3-CALIBRATION] INFO: Started: 2026-01-15T00:05:02.491118+00:00
2026-01-15 01:05:02,501 [PHASE3-CALIBRATION] INFO: ============================================================
2026-01-15 01:05:02,553 [PHASE3-CALIBRATION] INFO: Starting learning classification update...
2026-01-15 01:05:04,776 [PHASE3-CALIBRATION] INFO: Classified 102 decisions: {'WISDOM': 58, 'REGRET': 18, 'UNRESOLVED': 26}
2026-01-15 01:05:04,776 [PHASE3-CALIBRATION] INFO: Starting Brier score computation...
2026-01-15 01:05:07,613 [PHASE3-CALIBRATION] INFO: Computed 488 new Brier scores: avg=0.5253848360655738, accuracy=35.450819672131146%
2026-01-15 01:05:07,613 [PHASE3-CALIBRATION] INFO: Starting forecast-outcome reconciliation...
2026-01-15 01:05:09,298 [PHASE3-CALIBRATION] INFO: Reconciliation complete: 9 outcomes, 0 pairs
2026-01-15 01:05:09,309 [PHASE3-CALIBRATION] INFO: Refreshing materialized views...
2026-01-15 01:05:09,395 [PHASE3-CALIBRATION] INFO: Materialized views refreshed
2026-01-15 01:05:09,413 [PHASE3-CALIBRATION] INFO: Governance action logged: b169eb41-8e14-4c69-8975-f1e642017e4c
2026-01-15 01:05:09,414 [PHASE3-CALIBRATION] INFO: Calibration status: Brier=0.5775
2026-01-15 01:05:09,414 [PHASE3-CALIBRATION] WARNING: CALIBRATION WARNING: Brier score 0.5775 > 0.3. High-confidence decisions should be flagged.
2026-01-15 01:05:09,414 [PHASE3-CALIBRATION] INFO: ============================================================
2026-01-15 01:05:09,414 [PHASE3-CALIBRATION] INFO: PHASE 3 CALIBRATION COMPLETE
2026-01-15 01:05:09,414 [PHASE3-CALIBRATION] INFO: Duration: 6.90s
2026-01-15 01:05:09,414 [PHASE3-CALIBRATION] INFO: ============================================================
{
  "directive": "CEO-DIR-2026-025",
  "daemon_version": "1.0.0",
  "execution_mode": "DEFENSIVE_ONLY",
  "start_time": "2026-01-15T00:05:02.491118+00:00",
  "results": {
    "classifications": {
      "WISDOM": 58,
      "REGRET": 18,
      "UNRESOLVED": 26
    },
    "brier_scores": {
      "new_scores": 488,
      "avg_brier": 0.5254,
      "accuracy_pct": 35.5
    },
    "reconciliation": {
      "outcomes_created": 9,
      "pairs_created": 0
    },
    "calibration_status": {
      "total_scores": 2682,
      "avg_brier": "0.5775",
      "correct": 762,
      "overconfident_wrong": 1216
    }
  },
  "end_time": "2026-01-15T00:05:09.395823+00:00",
  "duration_seconds": 6.904705,
  "status": "SUCCESS"
}
[15.01.2026  1:05:09,45] Daemon execution complete 
[16.01.2026  1:05:01,93] Starting Phase 3 Calibration Daemon 
2026-01-16 01:05:02,210 [PHASE3-CALIBRATION] INFO: ============================================================
2026-01-16 01:05:02,210 [PHASE3-CALIBRATION] INFO: PHASE 3 CALIBRATION DAEMON - CEO-DIR-2026-025
2026-01-16 01:05:02,210 [PHASE3-CALIBRATION] INFO: Mode: DEFENSIVE_ONLY
2026-01-16 01:05:02,210 [PHASE3-CALIBRATION] INFO: Started: 2026-01-16T00:05:02.210747+00:00
2026-01-16 01:05:02,210 [PHASE3-CALIBRATION] INFO: ============================================================
2026-01-16 01:05:02,394 [PHASE3-CALIBRATION] INFO: Starting learning classification update...
2026-01-16 01:05:04,364 [PHASE3-CALIBRATION] INFO: Classified 110 decisions: {'WISDOM': 66, 'REGRET': 10, 'UNRESOLVED': 34}
2026-01-16 01:05:04,364 [PHASE3-CALIBRATION] INFO: Starting Brier score computation...
2026-01-16 01:05:08,603 [PHASE3-CALIBRATION] INFO: Computed 543 new Brier scores: avg=0.5931462246777164, accuracy=26.887661141804784%
2026-01-16 01:05:08,604 [PHASE3-CALIBRATION] INFO: Starting forecast-outcome reconciliation...
2026-01-16 01:05:11,230 [PHASE3-CALIBRATION] INFO: Reconciliation complete: 0 outcomes, 200 pairs
2026-01-16 01:05:11,239 [PHASE3-CALIBRATION] INFO: Refreshing materialized views...
2026-01-16 01:05:11,302 [PHASE3-CALIBRATION] INFO: Materialized views refreshed
2026-01-16 01:05:11,310 [PHASE3-CALIBRATION] INFO: Governance action logged: 1cb081d2-44f0-4d2b-9fa4-c25a67b52733
2026-01-16 01:05:11,310 [PHASE3-CALIBRATION] INFO: Calibration status: Brier=0.5802
2026-01-16 01:05:11,311 [PHASE3-CALIBRATION] WARNING: CALIBRATION WARNING: Brier score 0.5802 > 0.3. High-confidence decisions should be flagged.
2026-01-16 01:05:11,311 [PHASE3-CALIBRATION] INFO: ============================================================
2026-01-16 01:05:11,311 [PHASE3-CALIBRATION] INFO: PHASE 3 CALIBRATION COMPLETE
2026-01-16 01:05:11,311 [PHASE3-CALIBRATION] INFO: Duration: 9.09s
2026-01-16 01:05:11,311 [PHASE3-CALIBRATION] INFO: ============================================================
{
  "directive": "CEO-DIR-2026-025",
  "daemon_version": "1.0.0",
  "execution_mode": "DEFENSIVE_ONLY",
  "start_time": "2026-01-16T00:05:02.210747+00:00",
  "results": {
    "classifications": {
      "WISDOM": 66,
      "REGRET": 10,
      "UNRESOLVED": 34
    },
    "brier_scores": {
      "new_scores": 543,
      "avg_brier": 0.5931,
      "accuracy_pct": 26.9
    },
    "reconciliation": {
      "outcomes_created": 0,
      "pairs_created": 200
    },
    "calibration_status": {
      "total_scores": 3225,
      "avg_brier": "0.5802",
      "correct": 908,
      "overconfident_wrong": 1467
    }
  },
  "end_time": "2026-01-16T00:05:11.302714+00:00",
  "duration_seconds": 9.091967,
  "status": "SUCCESS"
}
[16.01.2026  1:05:11,34] Daemon execution complete 
[17.01.2026  1:05:06,20] Starting Phase 3 Calibration Daemon 
2026-01-17 01:05:06,459 [PHASE3-CALIBRATION] INFO: ============================================================
2026-01-17 01:05:06,459 [PHASE3-CALIBRATION] INFO: PHASE 3 CALIBRATION DAEMON - CEO-DIR-2026-025
2026-01-17 01:05:06,459 [PHASE3-CALIBRATION] INFO: Mode: DEFENSIVE_ONLY
2026-01-17 01:05:06,459 [PHASE3-CALIBRATION] INFO: Started: 2026-01-17T00:05:06.459103+00:00
2026-01-17 01:05:06,459 [PHASE3-CALIBRATION] INFO: ============================================================
2026-01-17 01:05:06,538 [PHASE3-CALIBRATION] INFO: Starting learning classification update...
2026-01-17 01:05:08,385 [PHASE3-CALIBRATION] INFO: Classified 22 decisions: {'WISDOM': 16, 'REGRET': 2, 'UNRESOLVED': 4}
2026-01-17 01:05:08,385 [PHASE3-CALIBRATION] INFO: Starting Brier score computation...
2026-01-17 01:05:10,441 [PHASE3-CALIBRATION] INFO: Computed 376 new Brier scores: avg=0.6599476063829787, accuracy=20.212765957446805%
2026-01-17 01:05:10,441 [PHASE3-CALIBRATION] INFO: Starting forecast-outcome reconciliation...
2026-01-17 01:05:11,735 [PHASE3-CALIBRATION] INFO: Reconciliation complete: 6 outcomes, 0 pairs
2026-01-17 01:05:11,744 [PHASE3-CALIBRATION] INFO: Refreshing materialized views...
2026-01-17 01:05:11,787 [PHASE3-CALIBRATION] INFO: Materialized views refreshed
2026-01-17 01:05:11,807 [PHASE3-CALIBRATION] INFO: Governance action logged: a51cbabf-d3cb-444d-a20a-51618854e90f
2026-01-17 01:05:11,807 [PHASE3-CALIBRATION] INFO: Calibration status: Brier=0.5885
2026-01-17 01:05:11,807 [PHASE3-CALIBRATION] WARNING: CALIBRATION WARNING: Brier score 0.5885 > 0.3. High-confidence decisions should be flagged.
2026-01-17 01:05:11,807 [PHASE3-CALIBRATION] INFO: ============================================================
2026-01-17 01:05:11,807 [PHASE3-CALIBRATION] INFO: PHASE 3 CALIBRATION COMPLETE
2026-01-17 01:05:11,807 [PHASE3-CALIBRATION] INFO: Duration: 5.33s
2026-01-17 01:05:11,807 [PHASE3-CALIBRATION] INFO: ============================================================
{
  "directive": "CEO-DIR-2026-025",
  "daemon_version": "1.0.0",
  "execution_mode": "DEFENSIVE_ONLY",
  "start_time": "2026-01-17T00:05:06.459103+00:00",
  "results": {
    "classifications": {
      "WISDOM": 16,
      "REGRET": 2,
      "UNRESOLVED": 4
    },
    "brier_scores": {
      "new_scores": 376,
      "avg_brier": 0.6599,
      "accuracy_pct": 20.2
    },
    "reconciliation": {
      "outcomes_created": 6,
      "pairs_created": 0
    },
    "calibration_status": {
      "total_scores": 3601,
      "avg_brier": "0.5885",
      "correct": 984,
      "overconfident_wrong": 1619
    }
  },
  "end_time": "2026-01-17T00:05:11.787231+00:00",
  "duration_seconds": 5.328128,
  "status": "SUCCESS"
}
[17.01.2026  1:05:11,84] Daemon execution complete 
[18.01.2026  1:05:01,57] Starting Phase 3 Calibration Daemon 
2026-01-18 01:05:01,819 [PHASE3-CALIBRATION] INFO: ============================================================
2026-01-18 01:05:01,819 [PHASE3-CALIBRATION] INFO: PHASE 3 CALIBRATION DAEMON - CEO-DIR-2026-025
2026-01-18 01:05:01,819 [PHASE3-CALIBRATION] INFO: Mode: DEFENSIVE_ONLY
2026-01-18 01:05:01,819 [PHASE3-CALIBRATION] INFO: Started: 2026-01-18T00:05:01.819035+00:00
2026-01-18 01:05:01,819 [PHASE3-CALIBRATION] INFO: ============================================================
2026-01-18 01:05:01,891 [PHASE3-CALIBRATION] INFO: Starting learning classification update...
2026-01-18 01:05:03,236 [PHASE3-CALIBRATION] INFO: Classified 36 decisions: {'WISDOM': 20, 'REGRET': 6, 'UNRESOLVED': 10}
2026-01-18 01:05:03,236 [PHASE3-CALIBRATION] INFO: Starting Brier score computation...
2026-01-18 01:05:03,448 [PHASE3-CALIBRATION] ERROR: PHASE 3 CALIBRATION FAILED: record "v_tag" has no field "event_id"
CONTEXT:  PL/pgSQL assignment "NEW.adjacent_event_id := v_tag.event_id"
PL/pgSQL function fhq_governance.auto_tag_event_proximity() line 11 at assignment

Traceback (most recent call last):
  File "C:\fhq-market-system\vision-ios\03_FUNCTIONS\phase3_calibration_daemon.py", line 478, in <module>
    result = run_daily_calibration()
             ^^^^^^^^^^^^^^^^^^^^^^^
  File "C:\fhq-market-system\vision-ios\03_FUNCTIONS\phase3_calibration_daemon.py", line 415, in run_daily_calibration
    brier_results = update_brier_scores(conn)
                    ^^^^^^^^^^^^^^^^^^^^^^^^^
  File "C:\fhq-market-system\vision-ios\03_FUNCTIONS\phase3_calibration_daemon.py", line 169, in update_brier_scores
    cur.execute("""
  File "C:\Users\Ørjan Skjold\AppData\Local\Programs\Python\Python312\Lib\site-packages\psycopg2\extras.py", line 236, in execute
    return super().execute(query, vars)
           ^^^^^^^^^^^^^^^^^^^^^^^^^^^^
psycopg2.errors.UndefinedColumn: record "v_tag" has no field "event_id"
CONTEXT:  PL/pgSQL assignment "NEW.adjacent_event_id := v_tag.event_id"
PL/pgSQL function fhq_governance.auto_tag_event_proximity() line 11 at assignment

[18.01.2026  1:05:03,58] Daemon execution complete 
[19.01.2026  1:05:03,30] Starting Phase 3 Calibration Daemon 
2026-01-19 01:05:03,606 [PHASE3-CALIBRATION] INFO: ============================================================
2026-01-19 01:05:03,606 [PHASE3-CALIBRATION] INFO: PHASE 3 CALIBRATION DAEMON - CEO-DIR-2026-025
2026-01-19 01:05:03,616 [PHASE3-CALIBRATION] INFO: Mode: DEFENSIVE_ONLY
2026-01-19 01:05:03,616 [PHASE3-CALIBRATION] INFO: Started: 2026-01-19T00:05:03.606196+00:00
2026-01-19 01:05:03,616 [PHASE3-CALIBRATION] INFO: ============================================================
2026-01-19 01:05:03,699 [PHASE3-CALIBRATION] INFO: Starting learning classification update...
2026-01-19 01:05:04,869 [PHASE3-CALIBRATION] INFO: Classified 26 decisions: {'WISDOM': 11, 'REGRET': 4, 'UNRESOLVED': 11}
2026-01-19 01:05:04,869 [PHASE3-CALIBRATION] INFO: Starting Brier score computation...
2026-01-19 01:05:06,517 [PHASE3-CALIBRATION] ERROR: PHASE 3 CALIBRATION FAILED: record "v_tag" has no field "event_id"
CONTEXT:  PL/pgSQL assignment "NEW.adjacent_event_id := v_tag.event_id"
PL/pgSQL function fhq_governance.auto_tag_event_proximity() line 11 at assignment

Traceback (most recent call last):
  File "C:\fhq-market-system\vision-ios\03_FUNCTIONS\phase3_calibration_daemon.py", line 478, in <module>
    result = run_daily_calibration()
             ^^^^^^^^^^^^^^^^^^^^^^^
  File "C:\fhq-market-system\vision-ios\03_FUNCTIONS\phase3_calibration_daemon.py", line 415, in run_daily_calibration
    brier_results = update_brier_scores(conn)
                    ^^^^^^^^^^^^^^^^^^^^^^^^^
  File "C:\fhq-market-system\vision-ios\03_FUNCTIONS\phase3_calibration_daemon.py", line 169, in update_brier_scores
    cur.execute("""
  File "C:\Users\Ørjan Skjold\AppData\Local\Programs\Python\Python312\Lib\site-packages\psycopg2\extras.py", line 236, in execute
    return super().execute(query, vars)
           ^^^^^^^^^^^^^^^^^^^^^^^^^^^^
psycopg2.errors.UndefinedColumn: record "v_tag" has no field "event_id"
CONTEXT:  PL/pgSQL assignment "NEW.adjacent_event_id := v_tag.event_id"
PL/pgSQL function fhq_governance.auto_tag_event_proximity() line 11 at assignment

[19.01.2026  1:05:06,84] Daemon execution complete 
[20.01.2026  1:05:04,32] Starting Phase 3 Calibration Daemon 
2026-01-20 01:05:05,155 [PHASE3-CALIBRATION] INFO: ============================================================
2026-01-20 01:05:05,182 [PHASE3-CALIBRATION] INFO: PHASE 3 CALIBRATION DAEMON - CEO-DIR-2026-025
2026-01-20 01:05:05,183 [PHASE3-CALIBRATION] INFO: Mode: DEFENSIVE_ONLY
2026-01-20 01:05:05,183 [PHASE3-CALIBRATION] INFO: Started: 2026-01-20T00:05:05.155168+00:00
2026-01-20 01:05:05,183 [PHASE3-CALIBRATION] INFO: ============================================================
2026-01-20 01:05:05,438 [PHASE3-CALIBRATION] INFO: Starting learning classification update...
2026-01-20 01:05:08,982 [PHASE3-CALIBRATION] INFO: Classified 8 decisions: {'WISDOM': 3, 'REGRET': 2, 'UNRESOLVED': 3}
2026-01-20 01:05:08,983 [PHASE3-CALIBRATION] INFO: Starting Brier score computation...
2026-01-20 01:05:11,145 [PHASE3-CALIBRATION] ERROR: PHASE 3 CALIBRATION FAILED: record "v_tag" has no field "event_id"
CONTEXT:  PL/pgSQL assignment "NEW.adjacent_event_id := v_tag.event_id"
PL/pgSQL function fhq_governance.auto_tag_event_proximity() line 11 at assignment

Traceback (most recent call last):
  File "C:\fhq-market-system\vision-ios\03_FUNCTIONS\phase3_calibration_daemon.py", line 478, in <module>
    result = run_daily_calibration()
             ^^^^^^^^^^^^^^^^^^^^^^^
  File "C:\fhq-market-system\vision-ios\03_FUNCTIONS\phase3_calibration_daemon.py", line 415, in run_daily_calibration
    brier_results = update_brier_scores(conn)
                    ^^^^^^^^^^^^^^^^^^^^^^^^^
  File "C:\fhq-market-system\vision-ios\03_FUNCTIONS\phase3_calibration_daemon.py", line 169, in update_brier_scores
    cur.execute("""
  File "C:\Users\Ørjan Skjold\AppData\Local\Programs\Python\Python312\Lib\site-packages\psycopg2\extras.py", line 236, in execute
    return super().execute(query, vars)
           ^^^^^^^^^^^^^^^^^^^^^^^^^^^^
psycopg2.errors.UndefinedColumn: record "v_tag" has no field "event_id"
CONTEXT:  PL/pgSQL assignment "NEW.adjacent_event_id := v_tag.event_id"
PL/pgSQL function fhq_governance.auto_tag_event_proximity() line 11 at assignment

[20.01.2026  1:05:11,44] Daemon execution complete 
[21.01.2026  1:05:01,55] Starting Phase 3 Calibration Daemon 
2026-01-21 01:05:02,029 [PHASE3-CALIBRATION] INFO: ============================================================
2026-01-21 01:05:02,029 [PHASE3-CALIBRATION] INFO: PHASE 3 CALIBRATION DAEMON - CEO-DIR-2026-025
2026-01-21 01:05:02,029 [PHASE3-CALIBRATION] INFO: Mode: DEFENSIVE_ONLY
2026-01-21 01:05:02,029 [PHASE3-CALIBRATION] INFO: Started: 2026-01-21T00:05:02.029039+00:00
2026-01-21 01:05:02,029 [PHASE3-CALIBRATION] INFO: ============================================================
2026-01-21 01:05:02,090 [PHASE3-CALIBRATION] INFO: Starting learning classification update...
2026-01-21 01:05:03,419 [PHASE3-CALIBRATION] INFO: Classified 29 decisions: {'WISDOM': 13, 'REGRET': 2, 'UNRESOLVED': 14}
2026-01-21 01:05:03,419 [PHASE3-CALIBRATION] INFO: Starting Brier score computation...
2026-01-21 01:05:04,437 [PHASE3-CALIBRATION] INFO: Computed 0 new Brier scores: avg=None, accuracy=None%
2026-01-21 01:05:04,437 [PHASE3-CALIBRATION] INFO: Starting forecast-outcome reconciliation...
2026-01-21 01:05:05,526 [PHASE3-CALIBRATION] INFO: Reconciliation complete: 14 outcomes, 0 pairs
2026-01-21 01:05:05,533 [PHASE3-CALIBRATION] INFO: Refreshing materialized views...
2026-01-21 01:05:05,605 [PHASE3-CALIBRATION] INFO: Materialized views refreshed
2026-01-21 01:05:05,620 [PHASE3-CALIBRATION] INFO: Governance action logged: b89e7111-f51f-4e3e-a6f5-68e0fb438b1a
2026-01-21 01:05:05,620 [PHASE3-CALIBRATION] INFO: Calibration status: Brier=0.5662
2026-01-21 01:05:05,620 [PHASE3-CALIBRATION] WARNING: CALIBRATION WARNING: Brier score 0.5662 > 0.3. High-confidence decisions should be flagged.
2026-01-21 01:05:05,620 [PHASE3-CALIBRATION] INFO: ============================================================
2026-01-21 01:05:05,620 [PHASE3-CALIBRATION] INFO: PHASE 3 CALIBRATION COMPLETE
2026-01-21 01:05:05,620 [PHASE3-CALIBRATION] INFO: Duration: 3.58s
2026-01-21 01:05:05,620 [PHASE3-CALIBRATION] INFO: ============================================================
{
  "directive": "CEO-DIR-2026-025",
  "daemon_version": "1.0.0",
  "execution_mode": "DEFENSIVE_ONLY",
  "start_time": "2026-01-21T00:05:02.029039+00:00",
  "results": {
    "classifications": {
      "WISDOM": 13,
      "REGRET": 2,
      "UNRESOLVED": 14
    },
    "brier_scores": {
      "new_scores": 0,
      "avg_brier": null,
      "accuracy_pct": null
    },
    "reconciliation": {
      "outcomes_created": 14,
      "pairs_created": 0
    },
    "calibration_status": {
      "total_scores": 4831,
      "avg_brier": "0.5662",
      "correct": 1344,
      "overconfident_wrong": 2049
    }
  },
  "end_time": "2026-01-21T00:05:05.605602+00:00",
  "duration_seconds": 3.576563,
  "status": "SUCCESS"
}
[21.01.2026  1:05:05,65] Daemon execution complete 
[22.01.2026  1:05:01,63] Starting Phase 3 Calibration Daemon 
2026-01-22 01:05:01,917 [PHASE3-CALIBRATION] INFO: ============================================================
2026-01-22 01:05:01,919 [PHASE3-CALIBRATION] INFO: PHASE 3 CALIBRATION DAEMON - CEO-DIR-2026-025
2026-01-22 01:05:01,919 [PHASE3-CALIBRATION] INFO: Mode: DEFENSIVE_ONLY
2026-01-22 01:05:01,919 [PHASE3-CALIBRATION] INFO: Started: 2026-01-22T00:05:01.917952+00:00
2026-01-22 01:05:01,919 [PHASE3-CALIBRATION] INFO: ============================================================
2026-01-22 01:05:02,022 [PHASE3-CALIBRATION] INFO: Starting learning classification update...
2026-01-22 01:05:03,558 [PHASE3-CALIBRATION] INFO: Classified 42 decisions: {'WISDOM': 19, 'REGRET': 3, 'UNRESOLVED': 20}
2026-01-22 01:05:03,559 [PHASE3-CALIBRATION] INFO: Starting Brier score computation...
2026-01-22 01:05:03,680 [PHASE3-CALIBRATION] ERROR: PHASE 3 CALIBRATION FAILED: record "v_tag" has no field "event_id"
CONTEXT:  PL/pgSQL assignment "NEW.adjacent_event_id := v_tag.event_id"
PL/pgSQL function fhq_governance.auto_tag_event_proximity() line 11 at assignment

Traceback (most recent call last):
  File "C:\fhq-market-system\vision-ios\03_FUNCTIONS\phase3_calibration_daemon.py", line 478, in <module>
    result = run_daily_calibration()
             ^^^^^^^^^^^^^^^^^^^^^^^
  File "C:\fhq-market-system\vision-ios\03_FUNCTIONS\phase3_calibration_daemon.py", line 415, in run_daily_calibration
    brier_results = update_brier_scores(conn)
                    ^^^^^^^^^^^^^^^^^^^^^^^^^
  File "C:\fhq-market-system\vision-ios\03_FUNCTIONS\phase3_calibration_daemon.py", line 169, in update_brier_scores
    cur.execute("""
  File "C:\Users\Ørjan Skjold\AppData\Local\Programs\Python\Python312\Lib\site-packages\psycopg2\extras.py", line 236, in execute
    return super().execute(query, vars)
           ^^^^^^^^^^^^^^^^^^^^^^^^^^^^
psycopg2.errors.UndefinedColumn: record "v_tag" has no field "event_id"
CONTEXT:  PL/pgSQL assignment "NEW.adjacent_event_id := v_tag.event_id"
PL/pgSQL function fhq_governance.auto_tag_event_proximity() line 11 at assignment

[22.01.2026  1:05:03,85] Daemon execution complete 
[23.01.2026  1:05:01,62] Starting Phase 3 Calibration Daemon 
2026-01-23 01:05:01,990 [PHASE3-CALIBRATION] INFO: ============================================================
2026-01-23 01:05:01,990 [PHASE3-CALIBRATION] INFO: PHASE 3 CALIBRATION DAEMON - CEO-DIR-2026-025
2026-01-23 01:05:01,990 [PHASE3-CALIBRATION] INFO: Mode: DEFENSIVE_ONLY
2026-01-23 01:05:01,990 [PHASE3-CALIBRATION] INFO: Started: 2026-01-23T00:05:01.990908+00:00
2026-01-23 01:05:01,990 [PHASE3-CALIBRATION] INFO: ============================================================
2026-01-23 01:05:02,052 [PHASE3-CALIBRATION] INFO: Starting learning classification update...
2026-01-23 01:05:04,533 [PHASE3-CALIBRATION] INFO: Classified 191 decisions: {'WISDOM': 96, 'REGRET': 34, 'UNRESOLVED': 61}
2026-01-23 01:05:04,533 [PHASE3-CALIBRATION] INFO: Starting Brier score computation...
2026-01-23 01:05:06,409 [PHASE3-CALIBRATION] ERROR: PHASE 3 CALIBRATION FAILED: record "v_tag" has no field "event_id"
CONTEXT:  PL/pgSQL assignment "NEW.adjacent_event_id := v_tag.event_id"
PL/pgSQL function fhq_governance.auto_tag_event_proximity() line 11 at assignment

Traceback (most recent call last):
  File "C:\fhq-market-system\vision-ios\03_FUNCTIONS\phase3_calibration_daemon.py", line 478, in <module>
    result = run_daily_calibration()
             ^^^^^^^^^^^^^^^^^^^^^^^
  File "C:\fhq-market-system\vision-ios\03_FUNCTIONS\phase3_calibration_daemon.py", line 415, in run_daily_calibration
    brier_results = update_brier_scores(conn)
                    ^^^^^^^^^^^^^^^^^^^^^^^^^
  File "C:\fhq-market-system\vision-ios\03_FUNCTIONS\phase3_calibration_daemon.py", line 169, in update_brier_scores
    cur.execute("""
  File "C:\Users\Ørjan Skjold\AppData\Local\Programs\Python\Python312\Lib\site-packages\psycopg2\extras.py", line 236, in execute
    return super().execute(query, vars)
           ^^^^^^^^^^^^^^^^^^^^^^^^^^^^
psycopg2.errors.UndefinedColumn: record "v_tag" has no field "event_id"
CONTEXT:  PL/pgSQL assignment "NEW.adjacent_event_id := v_tag.event_id"
PL/pgSQL function fhq_governance.auto_tag_event_proximity() line 11 at assignment

[23.01.2026  1:05:06,59] Daemon execution complete 
[24.01.2026  1:05:01,74] Starting Phase 3 Calibration Daemon 
2026-01-24 01:05:02,493 [PHASE3-CALIBRATION] INFO: ============================================================
2026-01-24 01:05:02,494 [PHASE3-CALIBRATION] INFO: PHASE 3 CALIBRATION DAEMON - CEO-DIR-2026-025
2026-01-24 01:05:02,494 [PHASE3-CALIBRATION] INFO: Mode: DEFENSIVE_ONLY
2026-01-24 01:05:02,494 [PHASE3-CALIBRATION] INFO: Started: 2026-01-24T00:05:02.493666+00:00
2026-01-24 01:05:02,494 [PHASE3-CALIBRATION] INFO: ============================================================
2026-01-24 01:05:02,551 [PHASE3-CALIBRATION] INFO: Starting learning classification update...
2026-01-24 01:05:04,771 [PHASE3-CALIBRATION] INFO: Classified 36 decisions: {'WISDOM': 20, 'REGRET': 3, 'UNRESOLVED': 13}
2026-01-24 01:05:04,775 [PHASE3-CALIBRATION] INFO: Starting Brier score computation...
2026-01-24 01:05:08,025 [PHASE3-CALIBRATION] INFO: Computed 771 new Brier scores: avg=0.5917998702983138, accuracy=26.977950713359274%
2026-01-24 01:05:08,025 [PHASE3-CALIBRATION] INFO: Starting forecast-outcome reconciliation...
2026-01-24 01:05:09,660 [PHASE3-CALIBRATION] INFO: Reconciliation complete: 12 outcomes, 0 pairs
2026-01-24 01:05:09,665 [PHASE3-CALIBRATION] INFO: Refreshing materialized views...
2026-01-24 01:05:09,729 [PHASE3-CALIBRATION] INFO: Materialized views refreshed
2026-01-24 01:05:09,752 [PHASE3-CALIBRATION] INFO: Governance action logged: 4c4e21d5-095e-42de-8dd6-c1e4e466b961
2026-01-24 01:05:09,753 [PHASE3-CALIBRATION] INFO: Calibration status: Brier=0.5698
2026-01-24 01:05:09,753 [PHASE3-CALIBRATION] WARNING: CALIBRATION WARNING: Brier score 0.5698 > 0.3. High-confidence decisions should be flagged.
2026-01-24 01:05:09,753 [PHASE3-CALIBRATION] INFO: ============================================================
2026-01-24 01:05:09,753 [PHASE3-CALIBRATION] INFO: PHASE 3 CALIBRATION COMPLETE
2026-01-24 01:05:09,753 [PHASE3-CALIBRATION] INFO: Duration: 7.24s
2026-01-24 01:05:09,753 [PHASE3-CALIBRATION] INFO: ============================================================
{
  "directive": "CEO-DIR-2026-025",
  "daemon_version": "1.0.0",
  "execution_mode": "DEFENSIVE_ONLY",
  "start_time": "2026-01-24T00:05:02.493666+00:00",
  "results": {
    "classifications": {
      "WISDOM": 20,
      "REGRET": 3,
      "UNRESOLVED": 13
    },
    "brier_scores": {
      "new_scores": 771,
      "avg_brier": 0.5918,
      "accuracy_pct": 27.0
    },
    "reconciliation": {
      "outcomes_created": 12,
      "pairs_created": 0
    },
    "calibration_status": {
      "total_scores": 5602,
      "avg_brier": "0.5698",
      "correct": 1552,
      "overconfident_wrong": 2430
    }
  },
  "end_time": "2026-01-24T00:05:09.729467+00:00",
  "duration_seconds": 7.235801,
  "status": "SUCCESS"
}
[24.01.2026  1:05:09,88] Daemon execution complete 
[25.01.2026  1:05:02,76] Starting Phase 3 Calibration Daemon 
2026-01-25 01:05:03,406 [PHASE3-CALIBRATION] INFO: ============================================================
2026-01-25 01:05:03,407 [PHASE3-CALIBRATION] INFO: PHASE 3 CALIBRATION DAEMON - CEO-DIR-2026-025
2026-01-25 01:05:03,407 [PHASE3-CALIBRATION] INFO: Mode: DEFENSIVE_ONLY
2026-01-25 01:05:03,408 [PHASE3-CALIBRATION] INFO: Started: 2026-01-25T00:05:03.405326+00:00
2026-01-25 01:05:03,408 [PHASE3-CALIBRATION] INFO: ============================================================
2026-01-25 01:05:03,478 [PHASE3-CALIBRATION] INFO: Starting learning classification update...
2026-01-25 01:05:05,010 [PHASE3-CALIBRATION] INFO: Classified 71 decisions: {'WISDOM': 42, 'REGRET': 7, 'UNRESOLVED': 22}
2026-01-25 01:05:05,010 [PHASE3-CALIBRATION] INFO: Starting Brier score computation...
2026-01-25 01:05:07,006 [PHASE3-CALIBRATION] INFO: Computed 169 new Brier scores: avg=0.41608165680473375, accuracy=40.828402366863905%
2026-01-25 01:05:07,006 [PHASE3-CALIBRATION] INFO: Starting forecast-outcome reconciliation...
2026-01-25 01:05:08,130 [PHASE3-CALIBRATION] INFO: Reconciliation complete: 9 outcomes, 0 pairs
2026-01-25 01:05:08,145 [PHASE3-CALIBRATION] INFO: Refreshing materialized views...
2026-01-25 01:05:08,243 [PHASE3-CALIBRATION] INFO: Materialized views refreshed
2026-01-25 01:05:08,272 [PHASE3-CALIBRATION] INFO: Governance action logged: 273f45c9-0e69-46ee-b562-be1ba333faf7
2026-01-25 01:05:08,272 [PHASE3-CALIBRATION] INFO: Calibration status: Brier=0.5653
2026-01-25 01:05:08,272 [PHASE3-CALIBRATION] WARNING: CALIBRATION WARNING: Brier score 0.5653 > 0.3. High-confidence decisions should be flagged.
2026-01-25 01:05:08,272 [PHASE3-CALIBRATION] INFO: ============================================================
2026-01-25 01:05:08,273 [PHASE3-CALIBRATION] INFO: PHASE 3 CALIBRATION COMPLETE
2026-01-25 01:05:08,273 [PHASE3-CALIBRATION] INFO: Duration: 4.84s
2026-01-25 01:05:08,273 [PHASE3-CALIBRATION] INFO: ============================================================
{
  "directive": "CEO-DIR-2026-025",
  "daemon_version": "1.0.0",
  "execution_mode": "DEFENSIVE_ONLY",
  "start_time": "2026-01-25T00:05:03.405326+00:00",
  "results": {
    "classifications": {
      "WISDOM": 42,
      "REGRET": 7,
      "UNRESOLVED": 22
    },
    "brier_scores": {
      "new_scores": 169,
      "avg_brier": 0.4161,
      "accuracy_pct": 40.8
    },
    "reconciliation": {
      "outcomes_created": 9,
      "pairs_created": 0
    },
    "calibration_status": {
      "total_scores": 5771,
      "avg_brier": "0.5653",
      "correct": 1621,
      "overconfident_wrong": 2469
    }
  },
  "end_time": "2026-01-25T00:05:08.243591+00:00",
  "duration_seconds": 4.838265,
  "status": "SUCCESS"
}
[25.01.2026  1:05:08,30] Daemon execution complete 
[26.01.2026  1:05:01,84] Starting Phase 3 Calibration Daemon 
2026-01-26 01:05:02,644 [PHASE3-CALIBRATION] INFO: ============================================================
2026-01-26 01:05:02,645 [PHASE3-CALIBRATION] INFO: PHASE 3 CALIBRATION DAEMON - CEO-DIR-2026-025
2026-01-26 01:05:02,645 [PHASE3-CALIBRATION] INFO: Mode: DEFENSIVE_ONLY
2026-01-26 01:05:02,646 [PHASE3-CALIBRATION] INFO: Started: 2026-01-26T00:05:02.644408+00:00
2026-01-26 01:05:02,646 [PHASE3-CALIBRATION] INFO: ============================================================
2026-01-26 01:05:02,739 [PHASE3-CALIBRATION] INFO: Starting learning classification update...
2026-01-26 01:05:04,304 [PHASE3-CALIBRATION] INFO: Classified 12 decisions: {'WISDOM': 8, 'REGRET': 2, 'UNRESOLVED': 2}
2026-01-26 01:05:04,305 [PHASE3-CALIBRATION] INFO: Starting Brier score computation...
2026-01-26 01:05:07,562 [PHASE3-CALIBRATION] INFO: Computed 213 new Brier scores: avg=0.30236901408450706, accuracy=69.48356807511738%
2026-01-26 01:05:07,562 [PHASE3-CALIBRATION] INFO: Starting forecast-outcome reconciliation...
2026-01-26 01:05:11,427 [PHASE3-CALIBRATION] INFO: Reconciliation complete: 5 outcomes, 0 pairs
2026-01-26 01:05:11,734 [PHASE3-CALIBRATION] INFO: Refreshing materialized views...
2026-01-26 01:05:11,831 [PHASE3-CALIBRATION] INFO: Materialized views refreshed
2026-01-26 01:05:11,842 [PHASE3-CALIBRATION] INFO: Governance action logged: f0796ca6-cade-4f76-bc22-f808474be5b2
2026-01-26 01:05:11,842 [PHASE3-CALIBRATION] INFO: Calibration status: Brier=0.5559
2026-01-26 01:05:11,843 [PHASE3-CALIBRATION] WARNING: CALIBRATION WARNING: Brier score 0.5559 > 0.3. High-confidence decisions should be flagged.
2026-01-26 01:05:11,843 [PHASE3-CALIBRATION] INFO: ============================================================
2026-01-26 01:05:11,844 [PHASE3-CALIBRATION] INFO: PHASE 3 CALIBRATION COMPLETE
2026-01-26 01:05:11,844 [PHASE3-CALIBRATION] INFO: Duration: 9.19s
2026-01-26 01:05:11,845 [PHASE3-CALIBRATION] INFO: ============================================================
{
  "directive": "CEO-DIR-2026-025",
  "daemon_version": "1.0.0",
  "execution_mode": "DEFENSIVE_ONLY",
  "start_time": "2026-01-26T00:05:02.644408+00:00",
  "results": {
    "classifications": {
      "WISDOM": 8,
      "REGRET": 2,
      "UNRESOLVED": 2
    },
    "brier_scores": {
      "new_scores": 213,
      "avg_brier": 0.3024,
      "accuracy_pct": 69.5
    },
    "reconciliation": {
      "outcomes_created": 5,
      "pairs_created": 0
    },
    "calibration_status": {
      "total_scores": 5984,
      "avg_brier": "0.5559",
      "correct": 1769,
      "overconfident_wrong": 2505
    }
  },
  "end_time": "2026-01-26T00:05:11.832973+00:00",
  "duration_seconds": 9.188565,
  "status": "SUCCESS"
}
[26.01.2026  1:05:14,37] Daemon execution complete 
[27.01.2026  1:05:02,54] Starting Phase 3 Calibration Daemon 
2026-01-27 01:05:02,735 [PHASE3-CALIBRATION] INFO: ============================================================
2026-01-27 01:05:02,736 [PHASE3-CALIBRATION] INFO: PHASE 3 CALIBRATION DAEMON - CEO-DIR-2026-025
2026-01-27 01:05:02,737 [PHASE3-CALIBRATION] INFO: Mode: DEFENSIVE_ONLY
2026-01-27 01:05:02,737 [PHASE3-CALIBRATION] INFO: Started: 2026-01-27T00:05:02.735016+00:00
2026-01-27 01:05:02,737 [PHASE3-CALIBRATION] INFO: ============================================================
2026-01-27 01:05:02,876 [PHASE3-CALIBRATION] INFO: Starting learning classification update...
2026-01-27 01:05:04,337 [PHASE3-CALIBRATION] INFO: Classified 6 decisions: {'WISDOM': 2, 'REGRET': 2, 'UNRESOLVED': 2}
2026-01-27 01:05:04,338 [PHASE3-CALIBRATION] INFO: Starting Brier score computation...
2026-01-27 01:05:05,430 [PHASE3-CALIBRATION] INFO: Computed 267 new Brier scores: avg=0.6604322097378277, accuracy=25.0936329588015%
2026-01-27 01:05:05,430 [PHASE3-CALIBRATION] INFO: Starting forecast-outcome reconciliation...
2026-01-27 01:05:17,966 [PHASE3-CALIBRATION] INFO: Reconciliation complete: 10 outcomes, 0 pairs
2026-01-27 01:05:17,977 [PHASE3-CALIBRATION] INFO: Refreshing materialized views...
2026-01-27 01:05:18,029 [PHASE3-CALIBRATION] INFO: Materialized views refreshed
2026-01-27 01:05:18,033 [PHASE3-CALIBRATION] INFO: Governance action logged: ba9189d2-1bce-4ba3-a971-b5742f7ca103
2026-01-27 01:05:18,033 [PHASE3-CALIBRATION] INFO: Calibration status: Brier=0.5604
2026-01-27 01:05:18,033 [PHASE3-CALIBRATION] WARNING: CALIBRATION WARNING: Brier score 0.5604 > 0.3. High-confidence decisions should be flagged.
2026-01-27 01:05:18,034 [PHASE3-CALIBRATION] INFO: ============================================================
2026-01-27 01:05:18,034 [PHASE3-CALIBRATION] INFO: PHASE 3 CALIBRATION COMPLETE
2026-01-27 01:05:18,034 [PHASE3-CALIBRATION] INFO: Duration: 15.29s
2026-01-27 01:05:18,034 [PHASE3-CALIBRATION] INFO: ============================================================
{
  "directive": "CEO-DIR-2026-025",
  "daemon_version": "1.0.0",
  "execution_mode": "DEFENSIVE_ONLY",
  "start_time": "2026-01-27T00:05:02.735016+00:00",
  "results": {
    "classifications": {
      "WISDOM": 2,
      "REGRET": 2,
      "UNRESOLVED": 2
    },
    "brier_scores": {
      "new_scores": 267,
      "avg_brier": 0.6604,
      "accuracy_pct": 25.1
    },
    "reconciliation": {
      "outcomes_created": 10,
      "pairs_created": 0
    },
    "calibration_status": {
      "total_scores": 6251,
      "avg_brier": "0.5604",
      "correct": 1836,
      "overconfident_wrong": 2645
    }
  },
  "end_time": "2026-01-27T00:05:18.029131+00:00",
  "duration_seconds": 15.294115,
  "status": "SUCCESS"
}
[27.01.2026  1:05:18,15] Daemon execution complete 
[28.01.2026  1:05:05,10] Starting Phase 3 Calibration Daemon 
2026-01-28 01:05:05,545 [PHASE3-CALIBRATION] INFO: ============================================================
2026-01-28 01:05:05,548 [PHASE3-CALIBRATION] INFO: PHASE 3 CALIBRATION DAEMON - CEO-DIR-2026-025
2026-01-28 01:05:05,550 [PHASE3-CALIBRATION] INFO: Mode: DEFENSIVE_ONLY
2026-01-28 01:05:05,550 [PHASE3-CALIBRATION] INFO: Started: 2026-01-28T00:05:05.545875+00:00
2026-01-28 01:05:05,550 [PHASE3-CALIBRATION] INFO: ============================================================
2026-01-28 01:05:05,785 [PHASE3-CALIBRATION] INFO: Starting learning classification update...
2026-01-28 01:05:06,951 [PHASE3-CALIBRATION] INFO: Classified 27 decisions: {'WISDOM': 6, 'REGRET': 4, 'UNRESOLVED': 17}
2026-01-28 01:05:06,951 [PHASE3-CALIBRATION] INFO: Starting Brier score computation...
2026-01-28 01:05:08,622 [PHASE3-CALIBRATION] INFO: Computed 334 new Brier scores: avg=0.5884679640718562, accuracy=33.23353293413174%
2026-01-28 01:05:08,622 [PHASE3-CALIBRATION] INFO: Starting forecast-outcome reconciliation...
2026-01-28 01:05:16,677 [PHASE3-CALIBRATION] INFO: Reconciliation complete: 13 outcomes, 0 pairs
2026-01-28 01:05:16,687 [PHASE3-CALIBRATION] INFO: Refreshing materialized views...
2026-01-28 01:05:16,771 [PHASE3-CALIBRATION] INFO: Materialized views refreshed
2026-01-28 01:05:16,792 [PHASE3-CALIBRATION] INFO: Governance action logged: b59764f4-1b7f-4373-96de-54de2da8b04f
2026-01-28 01:05:16,792 [PHASE3-CALIBRATION] INFO: Calibration status: Brier=0.5618
2026-01-28 01:05:16,792 [PHASE3-CALIBRATION] WARNING: CALIBRATION WARNING: Brier score 0.5618 > 0.3. High-confidence decisions should be flagged.
2026-01-28 01:05:16,792 [PHASE3-CALIBRATION] INFO: ============================================================
2026-01-28 01:05:16,792 [PHASE3-CALIBRATION] INFO: PHASE 3 CALIBRATION COMPLETE
2026-01-28 01:05:16,792 [PHASE3-CALIBRATION] INFO: Duration: 11.23s
2026-01-28 01:05:16,792 [PHASE3-CALIBRATION] INFO: ============================================================
{
  "directive": "CEO-DIR-2026-025",
  "daemon_version": "1.0.0",
  "execution_mode": "DEFENSIVE_ONLY",
  "start_time": "2026-01-28T00:05:05.545875+00:00",
  "results": {
    "classifications": {
      "WISDOM": 6,
      "REGRET": 4,
      "UNRESOLVED": 17
    },
    "brier_scores": {
      "new_scores": 334,
      "avg_brier": 0.5885,
      "accuracy_pct": 33.2
    },
    "reconciliation": {
      "outcomes_created": 13,
      "pairs_created": 0
    },
    "calibration_status": {
      "total_scores": 6585,
      "avg_brier": "0.5618",
      "correct": 1947,
      "overconfident_wrong": 2814
    }
  },
  "end_time": "2026-01-28T00:05:16.771829+00:00",
  "duration_seconds": 11.225954,
  "status": "SUCCESS"
}
[28.01.2026  1:05:17,01] Daemon execution complete 
[29.01.2026  1:05:06,92] Starting Phase 3 Calibration Daemon 
2026-01-29 01:05:11,628 [PHASE3-CALIBRATION] INFO: ============================================================
2026-01-29 01:05:11,629 [PHASE3-CALIBRATION] INFO: PHASE 3 CALIBRATION DAEMON - CEO-DIR-2026-025
2026-01-29 01:05:11,629 [PHASE3-CALIBRATION] INFO: Mode: DEFENSIVE_ONLY
2026-01-29 01:05:11,629 [PHASE3-CALIBRATION] INFO: Started: 2026-01-29T00:05:11.628157+00:00
2026-01-29 01:05:11,629 [PHASE3-CALIBRATION] INFO: ============================================================
2026-01-29 01:05:11,705 [PHASE3-CALIBRATION] INFO: Starting learning classification update...
2026-01-29 01:05:13,584 [PHASE3-CALIBRATION] INFO: Classified 64 decisions: {'WISDOM': 23, 'REGRET': 11, 'UNRESOLVED': 30}
2026-01-29 01:05:13,584 [PHASE3-CALIBRATION] INFO: Starting Brier score computation...
2026-01-29 01:05:15,956 [PHASE3-CALIBRATION] INFO: Computed 505 new Brier scores: avg=0.6353766336633664, accuracy=26.33663366336634%
2026-01-29 01:05:15,957 [PHASE3-CALIBRATION] INFO: Starting forecast-outcome reconciliation...
2026-01-29 01:05:17,283 [PHASE3-CALIBRATION] INFO: Reconciliation complete: 12 outcomes, 0 pairs
2026-01-29 01:05:17,303 [PHASE3-CALIBRATION] INFO: Refreshing materialized views...
2026-01-29 01:05:17,395 [PHASE3-CALIBRATION] INFO: Materialized views refreshed
2026-01-29 01:05:17,426 [PHASE3-CALIBRATION] INFO: Governance action logged: 317f78c0-5843-4b75-86b9-1d2f777e65c7
2026-01-29 01:05:17,426 [PHASE3-CALIBRATION] INFO: Calibration status: Brier=0.5670
2026-01-29 01:05:17,426 [PHASE3-CALIBRATION] WARNING: CALIBRATION WARNING: Brier score 0.5670 > 0.3. High-confidence decisions should be flagged.
2026-01-29 01:05:17,427 [PHASE3-CALIBRATION] INFO: ============================================================
2026-01-29 01:05:17,427 [PHASE3-CALIBRATION] INFO: PHASE 3 CALIBRATION COMPLETE
2026-01-29 01:05:17,428 [PHASE3-CALIBRATION] INFO: Duration: 5.77s
2026-01-29 01:05:17,428 [PHASE3-CALIBRATION] INFO: ============================================================
{
  "directive": "CEO-DIR-2026-025",
  "daemon_version": "1.0.0",
  "execution_mode": "DEFENSIVE_ONLY",
  "start_time": "2026-01-29T00:05:11.628157+00:00",
  "results": {
    "classifications": {
      "WISDOM": 23,
      "REGRET": 11,
      "UNRESOLVED": 30
    },
    "brier_scores": {
      "new_scores": 505,
      "avg_brier": 0.6354,
      "accuracy_pct": 26.3
    },
    "reconciliation": {
      "outcomes_created": 12,
      "pairs_created": 0
    },
    "calibration_status": {
      "total_scores": 7090,
      "avg_brier": "0.5670",
      "correct": 2080,
      "overconfident_wrong": 3092
    }
  },
  "end_time": "2026-01-29T00:05:17.395678+00:00",
  "duration_seconds": 5.767521,
  "status": "SUCCESS"
}
[29.01.2026  1:05:17,55] Daemon execution complete 
[30.01.2026  1:05:02,37] Starting Phase 3 Calibration Daemon 
2026-01-30 01:05:02,646 [PHASE3-CALIBRATION] INFO: ============================================================
2026-01-30 01:05:02,647 [PHASE3-CALIBRATION] INFO: PHASE 3 CALIBRATION DAEMON - CEO-DIR-2026-025
2026-01-30 01:05:02,647 [PHASE3-CALIBRATION] INFO: Mode: DEFENSIVE_ONLY
2026-01-30 01:05:02,647 [PHASE3-CALIBRATION] INFO: Started: 2026-01-30T00:05:02.646956+00:00
2026-01-30 01:05:02,647 [PHASE3-CALIBRATION] INFO: ============================================================
2026-01-30 01:05:02,720 [PHASE3-CALIBRATION] INFO: Starting learning classification update...
2026-01-30 01:05:05,242 [PHASE3-CALIBRATION] INFO: Classified 143 decisions: {'WISDOM': 75, 'REGRET': 13, 'UNRESOLVED': 55}
2026-01-30 01:05:05,242 [PHASE3-CALIBRATION] INFO: Starting Brier score computation...
2026-01-30 01:05:08,054 [PHASE3-CALIBRATION] INFO: Computed 909 new Brier scores: avg=0.47337337733773377, accuracy=43.12431243124312%
2026-01-30 01:05:08,054 [PHASE3-CALIBRATION] INFO: Starting forecast-outcome reconciliation...
2026-01-30 01:05:09,584 [PHASE3-CALIBRATION] INFO: Reconciliation complete: 8 outcomes, 0 pairs
2026-01-30 01:05:09,600 [PHASE3-CALIBRATION] INFO: Refreshing materialized views...
2026-01-30 01:05:09,661 [PHASE3-CALIBRATION] INFO: Materialized views refreshed
2026-01-30 01:05:09,682 [PHASE3-CALIBRATION] INFO: Governance action logged: 99e6ff7b-d336-462b-ad00-c34272532231
2026-01-30 01:05:09,683 [PHASE3-CALIBRATION] INFO: Calibration status: Brier=0.5564
2026-01-30 01:05:09,683 [PHASE3-CALIBRATION] WARNING: CALIBRATION WARNING: Brier score 0.5564 > 0.3. High-confidence decisions should be flagged.
2026-01-30 01:05:09,683 [PHASE3-CALIBRATION] INFO: ============================================================
2026-01-30 01:05:09,683 [PHASE3-CALIBRATION] INFO: PHASE 3 CALIBRATION COMPLETE
2026-01-30 01:05:09,683 [PHASE3-CALIBRATION] INFO: Duration: 7.01s
2026-01-30 01:05:09,683 [PHASE3-CALIBRATION] INFO: ============================================================
{
  "directive": "CEO-DIR-2026-025",
  "daemon_version": "1.0.0",
  "execution_mode": "DEFENSIVE_ONLY",
  "start_time": "2026-01-30T00:05:02.646956+00:00",
  "results": {
    "classifications": {
      "WISDOM": 75,
      "REGRET": 13,
      "UNRESOLVED": 55
    },
    "brier_scores": {
      "new_scores": 909,
      "avg_brier": 0.4734,
      "accuracy_pct": 43.1
    },
    "reconciliation": {
      "outcomes_created": 8,
      "pairs_created": 0
    },
    "calibration_status": {
      "total_scores": 7999,
      "avg_brier": "0.5564",
      "correct": 2472,
      "overconfident_wrong": 3445
    }
  },
  "end_time": "2026-01-30T00:05:09.661721+00:00",
  "duration_seconds": 7.014765,
  "status": "SUCCESS"
}
[30.01.2026  1:05:10,17] Daemon execution complete 
[31.01.2026  1:05:02,28] Starting Phase 3 Calibration Daemon 
2026-01-31 01:05:02,776 [PHASE3-CALIBRATION] INFO: ============================================================
2026-01-31 01:05:02,776 [PHASE3-CALIBRATION] INFO: PHASE 3 CALIBRATION DAEMON - CEO-DIR-2026-025
2026-01-31 01:05:02,776 [PHASE3-CALIBRATION] INFO: Mode: DEFENSIVE_ONLY
2026-01-31 01:05:02,776 [PHASE3-CALIBRATION] INFO: Started: 2026-01-31T00:05:02.776079+00:00
2026-01-31 01:05:02,776 [PHASE3-CALIBRATION] INFO: ============================================================
2026-01-31 01:05:02,849 [PHASE3-CALIBRATION] INFO: Starting learning classification update...
2026-01-31 01:05:04,762 [PHASE3-CALIBRATION] INFO: Classified 25 decisions: {'WISDOM': 9, 'REGRET': 3, 'UNRESOLVED': 13}
2026-01-31 01:05:04,762 [PHASE3-CALIBRATION] INFO: Starting Brier score computation...
2026-01-31 01:05:07,548 [PHASE3-CALIBRATION] INFO: Computed 554 new Brier scores: avg=0.32249675090252705, accuracy=62.093862815884485%
2026-01-31 01:05:07,548 [PHASE3-CALIBRATION] INFO: Starting forecast-outcome reconciliation...
2026-01-31 01:05:09,138 [PHASE3-CALIBRATION] INFO: Reconciliation complete: 15 outcomes, 0 pairs
2026-01-31 01:05:09,149 [PHASE3-CALIBRATION] INFO: Refreshing materialized views...
2026-01-31 01:05:09,210 [PHASE3-CALIBRATION] INFO: Materialized views refreshed
2026-01-31 01:05:09,219 [PHASE3-CALIBRATION] INFO: Governance action logged: 228ac363-aaff-4d59-937e-fdfacfaa0d18
2026-01-31 01:05:09,219 [PHASE3-CALIBRATION] INFO: Calibration status: Brier=0.5412
2026-01-31 01:05:09,219 [PHASE3-CALIBRATION] WARNING: CALIBRATION WARNING: Brier score 0.5412 > 0.3. High-confidence decisions should be flagged.
2026-01-31 01:05:09,219 [PHASE3-CALIBRATION] INFO: ============================================================
2026-01-31 01:05:09,219 [PHASE3-CALIBRATION] INFO: PHASE 3 CALIBRATION COMPLETE
2026-01-31 01:05:09,219 [PHASE3-CALIBRATION] INFO: Duration: 6.43s
2026-01-31 01:05:09,219 [PHASE3-CALIBRATION] INFO: ============================================================
{
  "directive": "CEO-DIR-2026-025",
  "daemon_version": "1.0.0",
  "execution_mode": "DEFENSIVE_ONLY",
  "start_time": "2026-01-31T00:05:02.776079+00:00",
  "results": {
    "classifications": {
      "WISDOM": 9,
      "REGRET": 3,
      "UNRESOLVED": 13
    },
    "brier_scores": {
      "new_scores": 554,
      "avg_brier": 0.3225,
      "accuracy_pct": 62.1
    },
    "reconciliation": {
      "outcomes_created": 15,
      "pairs_created": 0
    },
    "calibration_status": {
      "total_scores": 8553,
      "avg_brier": "0.5412",
      "correct": 2816,
      "overconfident_wrong": 3581
    }
  },
  "end_time": "2026-01-31T00:05:09.210165+00:00",
  "duration_seconds": 6.434086,
  "status": "SUCCESS"
}
[31.01.2026  1:05:09,25] Daemon execution complete 
[01.02.2026  1:05:01,94] Starting Phase 3 Calibration Daemon 
2026-02-01 01:05:02,481 [PHASE3-CALIBRATION] INFO: ============================================================
2026-02-01 01:05:02,481 [PHASE3-CALIBRATION] INFO: PHASE 3 CALIBRATION DAEMON - CEO-DIR-2026-025
2026-02-01 01:05:02,481 [PHASE3-CALIBRATION] INFO: Mode: DEFENSIVE_ONLY
2026-02-01 01:05:02,481 [PHASE3-CALIBRATION] INFO: Started: 2026-02-01T00:05:02.481893+00:00
2026-02-01 01:05:02,481 [PHASE3-CALIBRATION] INFO: ============================================================
2026-02-01 01:05:02,561 [PHASE3-CALIBRATION] INFO: Starting learning classification update...
2026-02-01 01:05:05,679 [PHASE3-CALIBRATION] INFO: Classified 70 decisions: {'WISDOM': 33, 'REGRET': 8, 'UNRESOLVED': 29}
2026-02-01 01:05:05,695 [PHASE3-CALIBRATION] INFO: Starting Brier score computation...
2026-02-01 01:05:09,027 [PHASE3-CALIBRATION] INFO: Computed 592 new Brier scores: avg=0.06135912162162162, accuracy=93.58108108108108%
2026-02-01 01:05:09,027 [PHASE3-CALIBRATION] INFO: Starting forecast-outcome reconciliation...
2026-02-01 01:05:10,364 [PHASE3-CALIBRATION] INFO: Reconciliation complete: 10 outcomes, 0 pairs
2026-02-01 01:05:10,364 [PHASE3-CALIBRATION] INFO: Refreshing materialized views...
2026-02-01 01:05:10,451 [PHASE3-CALIBRATION] INFO: Materialized views refreshed
2026-02-01 01:05:10,467 [PHASE3-CALIBRATION] INFO: Governance action logged: 81b3d9e7-d10a-4896-8b3a-fc6b12e57f34
2026-02-01 01:05:10,467 [PHASE3-CALIBRATION] INFO: Calibration status: Brier=0.5102
2026-02-01 01:05:10,467 [PHASE3-CALIBRATION] WARNING: CALIBRATION WARNING: Brier score 0.5102 > 0.3. High-confidence decisions should be flagged.
2026-02-01 01:05:10,467 [PHASE3-CALIBRATION] INFO: ============================================================
2026-02-01 01:05:10,467 [PHASE3-CALIBRATION] INFO: PHASE 3 CALIBRATION COMPLETE
2026-02-01 01:05:10,467 [PHASE3-CALIBRATION] INFO: Duration: 7.97s
2026-02-01 01:05:10,467 [PHASE3-CALIBRATION] INFO: ============================================================
{
  "directive": "CEO-DIR-2026-025",
  "daemon_version": "1.0.0",
  "execution_mode": "DEFENSIVE_ONLY",
  "start_time": "2026-02-01T00:05:02.481893+00:00",
  "results": {
    "classifications": {
      "WISDOM": 33,
      "REGRET": 8,
      "UNRESOLVED": 29
    },
    "brier_scores": {
      "new_scores": 592,
      "avg_brier": 0.0614,
      "accuracy_pct": 93.6
    },
    "reconciliation": {
      "outcomes_created": 10,
      "pairs_created": 0
    },
    "calibration_status": {
      "total_scores": 9145,
      "avg_brier": "0.5102",
      "correct": 3370,
      "overconfident_wrong": 3614
    }
  },
  "end_time": "2026-02-01T00:05:10.451498+00:00",
  "duration_seconds": 7.969605,
  "status": "SUCCESS"
}
[01.02.2026  1:05:10,55] Daemon execution complete 
